{"$schema": "https://json-schema.org/draft/2020-12/schema", "description": "EnsPillars command AST schema — version 4 (skill full-track contract).", "title": "EnsPillarsCommandAST", "type": "object", "required": ["astVersion", "plugin", "constraints", "roots"], "properties": {"astVersion": {"const": 4, "description": "AST contract version (mandatory)."}, "plugin": {"type": "object", "required": ["name", "mcRange", "language", "framework", "locale"], "properties": {"name": {"type": "string"}, "mcRange": {"type": "string"}, "language": {"type": "string"}, "framework": {"type": "string"}, "locale": {"type": "string"}, "colorSystem": {"type": "string"}}}, "constraints": {"type": "array", "items": {"type": "string"}}, "integrationContracts": {"type": "array", "items": {"type": "object", "required": ["source", "kind", "references"], "properties": {"source": {"type": "string"}, "kind": {"type": "string"}, "references": {"type": "array", "items": {"type": "string"}}}}}, "permissions": {"type": "array", "items": {"type": "object", "required": ["node", "default", "checked"], "properties": {"node": {"type": "string"}, "default": {"type": "string"}, "checked": {"type": "boolean"}, "parent": {"type": "string"}, "grants": {"type": "array", "items": {"type": "string"}}, "notes": {"type": "string"}}}}, "roots": {"type": "array", "minItems": 1, "items": {"type": "object", "required": ["name", "permission", "console", "enabledFlag", "branches"], "properties": {"name": {"type": "string", "pattern": "^[a-z0-9]+$"}, "permission": {"type": "string"}, "console": {"type": "string", "enum": ["deny-quiet", "deny-message", "allow", "allow-limited"]}, "enabledFlag": {"type": "string"}, "aliases": {"type": "array", "items": {"type": "string"}}, "branches": {"type": "array", "minItems": 1, "items": {"type": "object", "required": ["path", "permission", "contexts", "confirmation", "completion", "handler", "messages", "disposition"], "properties": {"path": {"type": "array", "minItems": 1, "items": {"type": "string"}}, "permission": {"type": "string"}, "requiresPlayer": {"type": "boolean"}, "contexts": {"type": "array", "items": {"type": "string", "enum": ["player", "console", "command-block"]}}, "confirmation": {"type": "string", "enum": ["none", "two-step-gui", "confirm-token", "existing-reload-guard"]}, "completion": {"type": "array", "items": {"type": "object", "required": ["level", "source"], "properties": {"level": {"type": "integer", "minimum": 1}, "source": {"type": "string"}, "permissionGated": {"type": "boolean"}}}}}, "handler": {"type": "string"}, "messages": {"type": "array", "items": {"type": "string"}}, "disposition": {"type": "string", "enum": ["preserve", "alias", "add", "fix", "extend", "deprecate"]}, "compatNote": {"type": "string"}, "hotbar": {"type": "boolean"}, "rewardsHook": {"type": "boolean"}}}}}}}}