{"astVersion": 4, "constraints": ["Paper 1.20-1.21 (api-version 1.20, NMS yok)", "Kotlin raw Bukkit CommandExecutor (framework degisikligi yok)", "Tek locale TR messages.yml", "MiniMessage yok - legacy & kodlari belgeli tercih"], "integrationContracts": [{"kind": "hotbar-items", "references": ["pof menu", "pof shop", "pof spectate", "pof autojoin", "pof leave", "pof vote"], "source": "hotbar.yml"}, {"kind": "console-reward-commands", "references": ["rewards.win-commands", "rewards.draw-commands", "rewards.kill-commands"], "source": "config.yml rewards.*"}], "permissions": [{"checked": true, "default": "true", "node": "enspillars.use"}, {"checked": true, "default": "true", "node": "enspillars.vote"}, {"checked": true, "default": "true", "node": "enspillars.party"}, {"checked": true, "default": "true", "node": "enspillars.cosmetics"}, {"checked": true, "default": "true", "node": "enspillars.stats", "notes": "YENI: stats cosmetics'ten ayrildi"}, {"checked": true, "default": "true", "node": "enspillars.replay"}, {"checked": true, "default": "op", "node": "enspillars.forcestart", "notes": "admin fallback ile acilir"}, {"checked": true, "default": "op", "grants": ["enspillars.admin.reload", "enspillars.admin.import", "enspillars.admin.arena", "enspillars.admin.debug", "enspillars.admin.setup", "enspillars.forcestart"], "node": "enspillars.admin", "notes": "ONARILDI: olu nodedu, artik parent + kod fallback"}, {"checked": true, "default": "op", "node": "enspillars.admin.reload", "parent": "enspillars.admin"}, {"checked": true, "default": "op", "node": "enspillars.admin.import", "parent": "enspillars.admin"}, {"checked": true, "default": "op", "node": "enspillars.admin.arena", "parent": "enspillars.admin"}, {"checked": true, "default": "op", "node": "enspillars.admin.debug", "parent": "enspillars.admin"}, {"checked": true, "default": "op", "node": "enspillars.admin.setup", "parent": "enspillars.admin"}, {"checked": true, "default": "op", "node": "enspillars.cages.gold", "notes": "YENI: shop.yml rank ozel"}, {"checked": true, "default": "op", "node": "enspillars.cages.netherite", "notes": "YENI: shop.yml rank ozel"}, {"checked": true, "default": "op", "node": "enspillars.deathcries.dragon", "notes": "YENI: shop.yml rank ozel"}], "plugin": {"colorSystem": "legacy-&", "framework": "raw Bukkit CommandExecutor+TabCompleter", "language": "Kotlin JVM17", "locale": "tr", "mcRange": "Paper 1.20-1.21", "name": "EnsPillars"}, "roots": [{"name": "enspillars", "permission": "enspillars.use", "console": "allow", "enabledFlag": "commands.enspillars.enabled", "aliases": [], "branches": [{"path": ["info"], "permission": "enspillars.use", "requiresPlayer": false, "contexts": ["player", "console", "command-block"], "confirmation": "none", "completion": [{"level": 1, "source": "none"}], "handler": "InfoCommand.info", "messages": ["info"], "disposition": "preserve"}, {"path": ["version"], "permission": "enspillars.use", "requiresPlayer": false, "contexts": ["player", "console", "command-block"], "confirmation": "none", "completion": [{"level": 1, "source": "none"}], "handler": "InfoCommand.info", "messages": ["info", "version"], "disposition": "alias", "compatNote": "info ile ayni"}, {"path": ["help"], "permission": "enspillars.use", "requiresPlayer": false, "contexts": ["player", "console", "command-block"], "confirmation": "none", "completion": [{"level": 1, "source": "none"}], "handler": "InfoCommand.help", "messages": ["help"], "disposition": "preserve"}, {"path": ["reload"], "permission": "enspillars.admin.reload", "requiresPlayer": false, "contexts": ["player", "console", "command-block"], "confirmation": "existing-reload-guard", "completion": [{"level": 1, "source": "literal:all,config,messages,arena,shop,scoreboards,hotbar", "permissionGated": true}, {"level": 2, "source": "literal:confirm"}], "handler": "InfoCommand.reload", "messages": ["reload.confirm-warn", "reloaded"], "disposition": "preserve"}, {"path": ["reload", "<category>", "confirm"], "permission": "enspillars.admin.reload", "requiresPlayer": false, "contexts": ["player", "console", "command-block"], "confirmation": "existing-reload-guard", "completion": [{"level": 1, "source": "literal:category", "permissionGated": true}, {"level": 2, "source": "literal:confirm"}], "handler": "InfoCommand.reload", "messages": ["reload.confirm-warn", "reloaded"], "disposition": "extend"}, {"path": ["import"], "permission": "enspillars.admin.import", "requiresPlayer": false, "contexts": ["player", "console", "command-block"], "confirmation": "confirm-token", "completion": [{"level": 1, "source": "literal:confirm", "permissionGated": true}], "handler": "ImportRunner.run", "messages": ["confirm.warn", "import.done"], "disposition": "extend", "compatNote": "P0 onay"}, {"path": ["debug"], "permission": "enspillars.admin.debug", "requiresPlayer": false, "contexts": ["player", "console", "command-block"], "confirmation": "none", "completion": [{"level": 1, "source": "none", "permissionGated": true}], "handler": "InfoCommand.debug", "messages": ["debug.line"], "disposition": "fix"}]}, {"name": "pof", "permission": "enspillars.use", "console": "allow-limited", "enabledFlag": "commands.pof.enabled", "aliases": [], "branches": [{"path": ["hub"], "permission": "enspillars.use", "requiresPlayer": true, "contexts": ["player"], "confirmation": "none", "completion": [{"level": 1, "source": "none:bare-root"}], "handler": "PofCommand.bare", "messages": ["help-pof"], "disposition": "preserve", "hotbar": true}, {"path": ["help"], "permission": "enspillars.use", "requiresPlayer": false, "contexts": ["player", "console", "command-block"], "confirmation": "none", "completion": [{"level": 1, "source": "none"}], "handler": "PofCommand.help", "messages": ["help-pof"], "disposition": "preserve"}, {"path": ["join"], "permission": "enspillars.use", "requiresPlayer": true, "contexts": ["player"], "confirmation": "none", "completion": [{"level": 1, "source": "arena-ids:WAITING"}], "handler": "GameFlowCommands.join", "messages": ["join.not-player", "join.none", "join.already", "join.fail"], "disposition": "preserve", "hotbar": true, "compatNote": "[arena] opsiyonel korunur"}, {"path": ["leave"], "permission": "enspillars.use", "requiresPlayer": true, "contexts": ["player"], "confirmation": "none", "completion": [{"level": 1, "source": "none"}], "handler": "GameFlowCommands.leave", "messages": ["join.not-player", "leave.ok"], "disposition": "preserve", "hotbar": true}, {"path": ["menu"], "permission": "enspillars.use", "requiresPlayer": true, "contexts": ["player"], "confirmation": "none", "completion": [{"level": 1, "source": "none"}], "handler": "GameFlowCommands.menu", "messages": ["cmd.console-only"], "disposition": "fix", "hotbar": true, "compatNote": "console sessizligi onarildi"}, {"path": ["spectate"], "permission": "enspillars.use", "requiresPlayer": true, "contexts": ["player"], "confirmation": "none", "completion": [{"level": 1, "source": "online-players:in-game"}], "handler": "GameFlowCommands.spectate", "messages": ["join.not-player", "spectate.joined", "spectate.player-gone"], "disposition": "preserve", "hotbar": true, "compatNote": "[oyuncu] opsiyonel korunur"}, {"path": ["autojoin"], "permission": "enspillars.use", "requiresPlayer": true, "contexts": ["player"], "confirmation": "none", "completion": [{"level": 1, "source": "none"}], "handler": "GameFlowCommands.autojoin", "messages": ["auto.joined", "auto.none"], "disposition": "preserve", "hotbar": true}, {"path": ["forcestart"], "permission": "enspillars.forcestart", "requiresPlayer": true, "contexts": ["player"], "confirmation": "none", "completion": [{"level": 1, "source": "none", "permissionGated": true}], "handler": "GameFlowCommands.forcestart", "messages": ["force.started", "force.fail"], "disposition": "fix", "compatNote": "admin fallback"}, {"path": ["vote"], "permission": "enspillars.vote", "requiresPlayer": true, "contexts": ["player"], "confirmation": "none", "completion": [{"level": 1, "source": "literal:game,map"}], "handler": "VoteCommands.usage", "messages": ["vote.usage"], "disposition": "preserve", "hotbar": true}, {"path": ["vote", "game"], "permission": "enspillars.vote", "requiresPlayer": true, "contexts": ["player"], "confirmation": "none", "completion": [{"level": 1, "source": "literal:game"}, {"level": 2, "source": "enum:NORMAL,SHUFFLE,SWAP"}], "handler": "VoteCommands.voteGame", "messages": ["vote.game-ok", "vote.invalid"], "disposition": "preserve", "hotbar": true}, {"path": ["vote", "map"], "permission": "enspillars.vote", "requiresPlayer": true, "contexts": ["player"], "confirmation": "none", "completion": [{"level": 1, "source": "literal:map"}, {"level": 2, "source": "enum:NORMAL,LAVA_RISE,FRAGILE,TNT_RAIN,ABLOCKALYPSE,SHRINKING_BORDER"}], "handler": "VoteCommands.voteMap", "messages": ["vote.map-ok", "vote.invalid"], "disposition": "fix", "hotbar": true, "compatNote": "SHRINKING_BORDER eklendi"}, {"path": ["party"], "permission": "enspillars.party", "requiresPlayer": true, "contexts": ["player"], "confirmation": "none", "completion": [{"level": 1, "source": "literal:create,invite,accept,decline,leave,join"}], "handler": "PartyCommands", "messages": ["party.usage"], "disposition": "preserve"}, {"path": ["party", "create"], "permission": "enspillars.party", "requiresPlayer": true, "contexts": ["player"], "confirmation": "none", "completion": [{"level": 1, "source": "literal:create"}, {"level": 2, "source": "none"}], "handler": "PartyCommands.create", "messages": ["party.created", "party.already"], "disposition": "preserve"}, {"path": ["party", "invite"], "permission": "enspillars.party", "requiresPlayer": true, "contexts": ["player"], "confirmation": "none", "completion": [{"level": 1, "source": "literal:invite"}, {"level": 2, "source": "online-players"}], "handler": "PartyCommands.invite", "messages": ["party.invite-sent"], "disposition": "preserve"}, {"path": ["party", "accept"], "permission": "enspillars.party", "require